Sheet: VGA - Sys Clock
A2: VGA width | B2: 640 | C2: (pixels)
A3: VGA height | B3: 480 | C3: (pixels) | G3: Mega | H3: 1000000
A4: VGA pix clock | B4: 25.175 | C4: (MHz)
A5: Refresh rate | B5: 60 | C5: (Hz)
A6: Sys clock | B6: of:=100 -> 100 | C6: (MHz)
B8: Full Res | C8: Half Res | G8: Half width | H8: of:=[.B2]/2 -> 320 | I8: (pixels)
A9: Total pixels | B9: of:=[.B2]*[.B3] -> 307200 | C9: of:=[.H8]*[.H9] -> 76800 | D9: (pixels) | G9: Half height | H9: of:=[.B3]/2 -> 240 | I9: (pixels)
A10: FB reads for display | B10: of:=[.B9] -> 307200 | C10: of:=[.B3]*[.H8]*2 -> 307200 | D10: (pixels) | E10: Half res still has to read the lines twice, unless we buffer a whole line
A11: Frame rate | B11: of:=[.B5] -> 60 | C11: of:=[.B5]/2 -> 30 | D11: (Hz)
A12: Total Sys clks per frame | B12: of:=[.H3]*[.B6]/[.B11] -> 1666666.66666667 | C12: of:=[.H3]*[.B6]/[.C11] -> 3333333.33333333
A13: Leftover sys clks per frame | B13: of:=[.B12]-[.B10] -> 1359466.66666667 | C13: of:=[.C12]-[.C10] -> 3026133.33333333
A14: Leftover sys clks per pixel | B14: of:=[.B13]/[.B9] -> 4.42534722222222 | C14: of:=[.C13]/[.C9] -> 39.4027777777778

Sheet: FPGA Resource Allocations
A1: EP4CE115
A3: LE | B3: 114000
A4: M9Ks | B4: 432
A5: Mul18s | B5: 266 | F5: Texture mem
F6: Tex square dim | G6: 64
F7: Pixels | G7: of:=[.G6]*[.G6] -> 4096
A8: Bits per block | B8: 9216 | F8: Bits per pixel | G8: 18 | H8: RGBA 5:6:5:1
A9: Nonparity Bits per block | B9: 8192 | F9: Bits needed | G9: of:=[.G7]*[.G8] -> 73728
F10: Blocks needed | G10: of:=[.G9]/[.B8] -> 8
A11: Bits per half block | B11: of:=[.B8]/2 -> 4608
A12: Nonparity Bits per half block | B12: of:=[.B9]/2 -> 4096 | F12: Gamma lookup | H12: Good candidate for a half block
F13: Bytes | G13: 256
F14: Blocks | G14: of:=[.G13]*8/[.B9] -> 0.25